study_ID,Key,Item Type,Publication Year,Author,Title,Publication Title,ISBN,ISSN,DOI,Url,Abstract Note,Date,Date Added,Date Modified,Access Date,Pages,Num Pages,Issue,Volume,Number Of Volumes,Journal Abbreviation,Short Title,Series,Series Number,Series Text,Series Title,Publisher,Place,Language,Rights,Type,Archive,Archive Location,Library Catalog,Call Number,Extra,Notes,File Attachments,Link Attachments,Manual Tags,Automatic Tags,Editor,Series Editor,Translator,Contributor,Attorney Agent,Book Author,Cast Member,Commenter,Composer,Cosponsor,Counsel,Interviewer,Producer,Recipient,Reviewed Author,Scriptwriter,Words By,Guest,Number,Edition,Running Time,Scale,Medium,Artwork Size,Filing Date,Application Number,Assignee,Issuing Authority,Country,Meeting Name,Conference Name,Court,References,Reporter,Legal Status,Priority Numbers,Programming Language,Version,System,Code,Code Number,Section,Session,Committee,History,Legislative Body
AZEVEDO_2020_MON,D639SW74,journalArticle,2020,"Azevedo, Joana; Antunes, Jorge T.; Machado, André M.; Vasconcelos, Vitor; Leão, Pedro N.; Froufe, Elsa",Monitoring of biofouling communities in a Portuguese port using a combined morphological and metabarcoding approach,Scientific Reports,NA,2045-2322,10.1038/s41598-020-70307-4,http://www.nature.com/articles/s41598-020-70307-4,NA,2020-12,2021-04-18T10:17:15Z,2021-04-18T10:17:15Z,2021-04-18T10:17:15Z,13461,NA,1,10,NA,Sci Rep,NA,NA,NA,NA,NA,NA,NA,en,NA,NA,NA,NA,DOI.org (Crossref),NA,NA,NA,NA,NA,NA,NA,NA,NA,NA,NA,NA,NA,NA,NA,NA,NA,NA,NA,NA,NA,NA,NA,NA,NA,NA,NA,NA,NA,NA,NA,NA,NA,NA,NA,NA,NA,NA,NA,NA,NA,NA,NA,NA,NA,NA,NA,NA,NA,NA,NA,NA,NA
CLOSEK_2019_MAR,PMMZN6PH,journalArticle,2019,"Closek, Collin J.; Santora, Jarrod A.; Starks, Hilary A.; Schroeder, Isaac D.; Andruszkiewicz, Elizabeth A.; Sakuma, Keith M.; Bograd, Steven J.; Hazen, Elliott L.; Field, John C.; Boehm, Alexandria B.",Marine Vertebrate Biodiversity and Distribution Within the Central California Current Using Environmental DNA (eDNA) Metabarcoding and Ecosystem Surveys,Frontiers in Marine Science,NA,2296-7745,10.3389/fmars.2019.00732,https://www.frontiersin.org/article/10.3389/fmars.2019.00732/full,NA,2019-12-16,2021-04-18T10:17:15Z,2021-04-18T10:17:15Z,2021-04-18T10:17:15Z,732,NA,NA,6,NA,Front. Mar. Sci.,NA,NA,NA,NA,NA,NA,NA,NA,NA,NA,NA,NA,DOI.org (Crossref),NA,NA,NA,NA,NA,NA,NA,NA,NA,NA,NA,NA,NA,NA,NA,NA,NA,NA,NA,NA,NA,NA,NA,NA,NA,NA,NA,NA,NA,NA,NA,NA,NA,NA,NA,NA,NA,NA,NA,NA,NA,NA,NA,NA,NA,NA,NA,NA,NA,NA,NA,NA,NA
LIU_2017_THE,AJ66WUWG,journalArticle,2017,"Liu, Yun; Song, Shuqun; Chen, Tiantian; Li, Caiwen",The diversity and structure of marine protists in the coastal waters of China revealed by morphological observation and 454 pyrosequencing,"Estuarine, Coastal and Shelf Science",NA,2727714,10.1016/j.ecss.2017.03.019,https://linkinghub.elsevier.com/retrieve/pii/S0272771417302792,NA,2017-04,2021-04-18T10:17:15Z,2021-04-18T10:17:15Z,2021-04-18T10:17:15Z,143-155,NA,NA,189,NA,"Estuarine, Coastal and Shelf Science",NA,NA,NA,NA,NA,NA,NA,en,NA,NA,NA,NA,DOI.org (Crossref),NA,NA,NA,NA,NA,NA,NA,NA,NA,NA,NA,NA,NA,NA,NA,NA,NA,NA,NA,NA,NA,NA,NA,NA,NA,NA,NA,NA,NA,NA,NA,NA,NA,NA,NA,NA,NA,NA,NA,NA,NA,NA,NA,NA,NA,NA,NA,NA,NA,NA,NA,NA,NA
BORRELL_2017_DNA,G4WIZSGR,journalArticle,2017,"Borrell, Yaisel J.; Miralles, Laura; Do Huu, Hoang; Mohammed-Geba, Khaled; Garcia-Vazquez, Eva",DNA in a bottle—Rapid metabarcoding survey for early alerts of invasive species in ports,PLOS ONE,NA,1932-6203,10.1371/journal.pone.0183347,https://dx.plos.org/10.1371/journal.pone.0183347,NA,2017-09-05,2021-04-18T10:17:15Z,2021-04-18T10:17:15Z,2021-04-18T10:17:15Z,e0183347,NA,9,12,NA,PLoS ONE,NA,NA,NA,NA,NA,NA,NA,en,NA,NA,NA,NA,DOI.org (Crossref),NA,NA,NA,NA,NA,NA,NA,"Doi, Hideyuki",NA,NA,NA,NA,NA,NA,NA,NA,NA,NA,NA,NA,NA,NA,NA,NA,NA,NA,NA,NA,NA,NA,NA,NA,NA,NA,NA,NA,NA,NA,NA,NA,NA,NA,NA,NA,NA,NA,NA,NA,NA,NA,NA,NA,NA
OLDS_2016_EST,A9D35MFY,journalArticle,2016,"Olds, Brett P.; Jerde, Christopher L.; Renshaw, Mark A.; Li, Yiyuan; Evans, Nathan T.; Turner, Cameron R.; Deiner, Kristy; Mahon, Andrew R.; Brueseke, Michael A.; Shirey, Patrick D.; Pfrender, Michael E.; Lodge, David M.; Lamberti, Gary A.","Estimating species richness using environmental <span style=""font-variant:small-caps;"">DNA</span>",Ecology and Evolution,NA,"2045-7758, 2045-7758",10.1002/ece3.2186,https://onlinelibrary.wiley.com/doi/10.1002/ece3.2186,NA,2016-06,2021-04-18T10:17:16Z,2021-04-18T10:17:16Z,2021-04-18T10:17:16Z,4214-4226,NA,12,6,NA,Ecol Evol,"Estimating species richness using environmental <span style=""font-variant",NA,NA,NA,NA,NA,NA,en,NA,NA,NA,NA,DOI.org (Crossref),NA,NA,NA,NA,NA,NA,NA,NA,NA,NA,NA,NA,NA,NA,NA,NA,NA,NA,NA,NA,NA,NA,NA,NA,NA,NA,NA,NA,NA,NA,NA,NA,NA,NA,NA,NA,NA,NA,NA,NA,NA,NA,NA,NA,NA,NA,NA,NA,NA,NA,NA,NA,NA
RIVERA_2018_MET,M8BJ99BN,journalArticle,2018,"Rivera, S. F.; Vasselon, V.; Jacquet, S.; Bouchez, A.; Ariztegui, D.; Rimet, F.",Metabarcoding of lake benthic diatoms: from structure assemblages to ecological assessment,Hydrobiologia,NA,"0018-8158, 1573-5117",10.1007/s10750-017-3381-2,http://link.springer.com/10.1007/s10750-017-3381-2,NA,2018-02,2021-04-18T10:17:17Z,2021-04-18T10:17:17Z,2021-04-18T10:17:17Z,37-51,NA,1,807,NA,Hydrobiologia,Metabarcoding of lake benthic diatoms,NA,NA,NA,NA,NA,NA,en,NA,NA,NA,NA,DOI.org (Crossref),NA,NA,NA,NA,NA,NA,NA,NA,NA,NA,NA,NA,NA,NA,NA,NA,NA,NA,NA,NA,NA,NA,NA,NA,NA,NA,NA,NA,NA,NA,NA,NA,NA,NA,NA,NA,NA,NA,NA,NA,NA,NA,NA,NA,NA,NA,NA,NA,NA,NA,NA,NA,NA
NGUYEN_2020_ENV,3YFHFIBN,journalArticle,2020,"Nguyen, Bryan N.; Shen, Elaine W.; Seemann, Janina; Correa, Adrienne M. S.; O’Donnell, James L.; Altieri, Andrew H.; Knowlton, Nancy; Crandall, Keith A.; Egan, Scott P.; McMillan, W. Owen; Leray, Matthieu",Environmental DNA survey captures patterns of fish and invertebrate diversity across a tropical seascape,Scientific Reports,NA,2045-2322,10.1038/s41598-020-63565-9,http://www.nature.com/articles/s41598-020-63565-9,NA,2020-12,2021-04-18T10:17:17Z,2021-04-18T10:17:17Z,2021-04-18T10:17:17Z,6729,NA,1,10,NA,Sci Rep,NA,NA,NA,NA,NA,NA,NA,en,NA,NA,NA,NA,DOI.org (Crossref),NA,NA,NA,NA,NA,NA,NA,NA,NA,NA,NA,NA,NA,NA,NA,NA,NA,NA,NA,NA,NA,NA,NA,NA,NA,NA,NA,NA,NA,NA,NA,NA,NA,NA,NA,NA,NA,NA,NA,NA,NA,NA,NA,NA,NA,NA,NA,NA,NA,NA,NA,NA,NA
KELLY_2017_GEN,VLRWPZVE,journalArticle,2017,"Kelly, Ryan P.; Closek, Collin J.; O'Donnell, James L.; Kralj, James E.; Shelton, Andrew O.; Samhouri, Jameal F.",Genetic and Manual Survey Methods Yield Different and Complementary Views of an Ecosystem,Frontiers in Marine Science,NA,2296-7745,10.3389/fmars.2016.00283,http://journal.frontiersin.org/article/10.3389/fmars.2016.00283/full,NA,2017-01-09,2021-04-18T10:17:18Z,2021-04-18T10:17:18Z,2021-04-18T10:17:18Z,NA,NA,NA,3,NA,Front. Mar. Sci.,NA,NA,NA,NA,NA,NA,NA,NA,NA,NA,NA,NA,DOI.org (Crossref),NA,NA,NA,NA,NA,NA,NA,NA,NA,NA,NA,NA,NA,NA,NA,NA,NA,NA,NA,NA,NA,NA,NA,NA,NA,NA,NA,NA,NA,NA,NA,NA,NA,NA,NA,NA,NA,NA,NA,NA,NA,NA,NA,NA,NA,NA,NA,NA,NA,NA,NA,NA,NA
APOTHELOZ_2020_MON,7XUX2INU,journalArticle,2020,"Apothéloz‐Perret‐Gentil, Laure; Bouchez, Agnès; Cordier, Tristan; Cordonier, Arielle; Guéguen, Julie; Rimet, Frederic; Vasselon, Valentin; Pawlowski, Jan",Monitoring the ecological status of rivers with diatom eDNA metabarcoding: A comparison of taxonomic markers and analytical approaches for the inference of a molecular diatom index,Molecular Ecology,NA,"0962-1083, 1365-294X",10.1111/mec.15646,https://onlinelibrary.wiley.com/doi/10.1111/mec.15646,NA,2020-11-14,2021-04-18T10:17:18Z,2021-04-18T10:17:18Z,2021-04-18T10:17:18Z,mec.15646,NA,NA,NA,NA,Mol Ecol,Monitoring the ecological status of rivers with diatom eDNA metabarcoding,NA,NA,NA,NA,NA,NA,en,NA,NA,NA,NA,DOI.org (Crossref),NA,NA,NA,NA,NA,NA,NA,NA,NA,NA,NA,NA,NA,NA,NA,NA,NA,NA,NA,NA,NA,NA,NA,NA,NA,NA,NA,NA,NA,NA,NA,NA,NA,NA,NA,NA,NA,NA,NA,NA,NA,NA,NA,NA,NA,NA,NA,NA,NA,NA,NA,NA,NA
AFZALI_2021_COM,QDKWPCST,journalArticle,2021,"Afzali, Seyedeh Fatemeh; Bourdages, Hugo; Laporte, Martin; Mérot, Claire; Normandeau, Eric; Audet, Céline; Bernatchez, Louis","Comparing environmental metabarcoding and trawling survey of demersal fish communities in the Gulf of St. Lawrence, Canada",Environmental DNA,NA,"2637-4943, 2637-4943",10.1002/edn3.111,https://onlinelibrary.wiley.com/doi/10.1002/edn3.111,NA,2021-01,2021-04-18T10:17:19Z,2021-04-18T10:17:19Z,2021-04-18T10:17:19Z,22-42,NA,1,3,NA,Environmental DNA,NA,NA,NA,NA,NA,NA,NA,en,NA,NA,NA,NA,DOI.org (Crossref),NA,NA,NA,NA,NA,NA,NA,NA,NA,NA,NA,NA,NA,NA,NA,NA,NA,NA,NA,NA,NA,NA,NA,NA,NA,NA,NA,NA,NA,NA,NA,NA,NA,NA,NA,NA,NA,NA,NA,NA,NA,NA,NA,NA,NA,NA,NA,NA,NA,NA,NA,NA,NA
ALSOS_2018_PLA,R7YG7NVR,journalArticle,2018,"Alsos, Inger Greve; Lammers, Youri; Yoccoz, Nigel Giles; Jørgensen, Tina; Sjögren, Per; Gielly, Ludovic; Edwards, Mary E.",Plant DNA metabarcoding of lake sediments: How does it represent the contemporary vegetation,PLOS ONE,NA,1932-6203,10.1371/journal.pone.0195403,https://dx.plos.org/10.1371/journal.pone.0195403,NA,2018-04-17,2021-04-18T10:17:19Z,2021-04-18T10:17:19Z,2021-04-18T10:17:19Z,e0195403,NA,4,13,NA,PLoS ONE,Plant DNA metabarcoding of lake sediments,NA,NA,NA,NA,NA,NA,en,NA,NA,NA,NA,DOI.org (Crossref),NA,NA,NA,NA,NA,NA,NA,"Carcaillet, Christopher",NA,NA,NA,NA,NA,NA,NA,NA,NA,NA,NA,NA,NA,NA,NA,NA,NA,NA,NA,NA,NA,NA,NA,NA,NA,NA,NA,NA,NA,NA,NA,NA,NA,NA,NA,NA,NA,NA,NA,NA,NA,NA,NA,NA,NA
BAILET_2020_DIA,FV9WU8B8,journalArticle,2020,"Bailet, Bonnie; Apothéloz-Perret-Gentil, Laure; Baričević, Ana; Chonova, Teofana; Franc, Alain; Frigerio, Jean-Marc; Kelly, Martyn; Mora, Demetrio; Pfannkuchen, Martin; Proft, Sebastian; Ramon, Mathieu; Vasselon, Valentin; Zimmermann, Jonas; Kahlert, Maria",Diatom DNA metabarcoding for ecological assessment: Comparison among bioinformatics pipelines used in six European countries reveals the need for standardization,Science of The Total Environment,NA,489697,10.1016/j.scitotenv.2020.140948,https://linkinghub.elsevier.com/retrieve/pii/S0048969720344776,NA,2020-11,2021-04-18T10:17:19Z,2021-04-18T10:17:19Z,2021-04-18T10:17:19Z,140948,NA,NA,745,NA,Science of The Total Environment,Diatom DNA metabarcoding for ecological assessment,NA,NA,NA,NA,NA,NA,en,NA,NA,NA,NA,DOI.org (Crossref),NA,NA,NA,NA,NA,NA,NA,NA,NA,NA,NA,NA,NA,NA,NA,NA,NA,NA,NA,NA,NA,NA,NA,NA,NA,NA,NA,NA,NA,NA,NA,NA,NA,NA,NA,NA,NA,NA,NA,NA,NA,NA,NA,NA,NA,NA,NA,NA,NA,NA,NA,NA,NA
PONT_2018_ENV,SUHZ5R4Y,journalArticle,2018,"Pont, Didier; Rocle, Mathieu; Valentini, Alice; Civade, Raphaël; Jean, Pauline; Maire, Anthony; Roset, Nicolas; Schabuss, Michael; Zornig, Horst; Dejean, Tony",Environmental DNA reveals quantitative patterns of fish biodiversity in large rivers despite its downstream transportation,Scientific Reports,NA,2045-2322,10.1038/s41598-018-28424-8,http://www.nature.com/articles/s41598-018-28424-8,NA,2018-12,2021-04-18T10:17:20Z,2021-04-18T10:17:20Z,2021-04-18T10:17:20Z,10361,NA,1,8,NA,Sci Rep,NA,NA,NA,NA,NA,NA,NA,en,NA,NA,NA,NA,DOI.org (Crossref),NA,NA,NA,NA,NA,NA,NA,NA,NA,NA,NA,NA,NA,NA,NA,NA,NA,NA,NA,NA,NA,NA,NA,NA,NA,NA,NA,NA,NA,NA,NA,NA,NA,NA,NA,NA,NA,NA,NA,NA,NA,NA,NA,NA,NA,NA,NA,NA,NA,NA,NA,NA,NA
SERRANA_2018_ECO,WR6VD7PF,journalArticle,2018,"Serrana, Joeselle M.; Yaegashi, Sakiko; Kondoh, Shunsuke; Li, Bin; Robinson, Christopher T.; Watanabe, Kozo",Ecological influence of sediment bypass tunnels on macroinvertebrates in dam-fragmented rivers by DNA metabarcoding,Scientific Reports,NA,2045-2322,10.1038/s41598-018-28624-2,http://www.nature.com/articles/s41598-018-28624-2,NA,2018-12,2021-04-18T10:17:20Z,2021-04-18T10:17:20Z,2021-04-18T10:17:20Z,10185,NA,1,8,NA,Sci Rep,NA,NA,NA,NA,NA,NA,NA,en,NA,NA,NA,NA,DOI.org (Crossref),NA,NA,NA,NA,NA,NA,NA,NA,NA,NA,NA,NA,NA,NA,NA,NA,NA,NA,NA,NA,NA,NA,NA,NA,NA,NA,NA,NA,NA,NA,NA,NA,NA,NA,NA,NA,NA,NA,NA,NA,NA,NA,NA,NA,NA,NA,NA,NA,NA,NA,NA,NA,NA
DJURHUUS_2018_EVA,TPHL3TSP,journalArticle,2018,"Djurhuus, Anni; Pitz, Kathleen; Sawaya, Natalie A.; Rojas-Márquez, Jaimie; Michaud, Brianna; Montes, Enrique; Muller-Karger, Frank; Breitbart, Mya",Evaluation of marine zooplankton community structure through environmental DNA metabarcoding: Metabarcoding zooplankton from eDNA,Limnology and Oceanography: Methods,NA,15415856,10.1002/lom3.10237,http://doi.wiley.com/10.1002/lom3.10237,NA,2018-04,2021-04-18T10:17:20Z,2021-04-18T10:17:20Z,2021-04-18T10:17:20Z,209-221,NA,4,16,NA,Limnol. Oceanogr. Methods,Evaluation of marine zooplankton community structure through environmental DNA metabarcoding,NA,NA,NA,NA,NA,NA,en,NA,NA,NA,NA,DOI.org (Crossref),NA,NA,NA,NA,NA,NA,NA,NA,NA,NA,NA,NA,NA,NA,NA,NA,NA,NA,NA,NA,NA,NA,NA,NA,NA,NA,NA,NA,NA,NA,NA,NA,NA,NA,NA,NA,NA,NA,NA,NA,NA,NA,NA,NA,NA,NA,NA,NA,NA,NA,NA,NA,NA
VISCO_2015_ENV,GTVJ22GY,journalArticle,2015,"Visco, Joana Amorim; Apothéloz-Perret-Gentil, Laure; Cordonier, Arielle; Esling, Philippe; Pillet, Loïc; Pawlowski, Jan",Environmental Monitoring: Inferring the Diatom Index from Next-Generation Sequencing Data,Environmental Science & Technology,NA,"0013-936X, 1520-5851",10.1021/es506158m,https://pubs.acs.org/doi/10.1021/es506158m,NA,2015-07-07,2021-04-18T10:17:21Z,2021-04-18T10:17:21Z,2021-04-18T10:17:21Z,7597-7605,NA,13,49,NA,Environ. Sci. Technol.,Environmental Monitoring,NA,NA,NA,NA,NA,NA,en,NA,NA,NA,NA,DOI.org (Crossref),NA,NA,NA,NA,NA,NA,NA,NA,NA,NA,NA,NA,NA,NA,NA,NA,NA,NA,NA,NA,NA,NA,NA,NA,NA,NA,NA,NA,NA,NA,NA,NA,NA,NA,NA,NA,NA,NA,NA,NA,NA,NA,NA,NA,NA,NA,NA,NA,NA,NA,NA,NA,NA
GRAN-STADNICZENKO_2017_HAP,AZ9YTVRM,journalArticle,2017,"Gran-Stadniczeñko, Sandra; Šupraha, Luka; Egge, Elianne D.; Edvardsen, Bente",Haptophyte Diversity and Vertical Distribution Explored by 18S and 28S Ribosomal RNA Gene Metabarcoding and Scanning Electron Microscopy,Journal of Eukaryotic Microbiology,NA,10665234,10.1111/jeu.12388,http://doi.wiley.com/10.1111/jeu.12388,NA,2017-07,2021-04-18T10:17:21Z,2021-04-18T10:17:21Z,2021-04-18T10:17:21Z,514-532,NA,4,64,NA,J. Eukaryot. Microbiol.,NA,NA,NA,NA,NA,NA,NA,en,NA,NA,NA,NA,DOI.org (Crossref),NA,NA,NA,NA,NA,NA,NA,NA,NA,NA,NA,NA,NA,NA,NA,NA,NA,NA,NA,NA,NA,NA,NA,NA,NA,NA,NA,NA,NA,NA,NA,NA,NA,NA,NA,NA,NA,NA,NA,NA,NA,NA,NA,NA,NA,NA,NA,NA,NA,NA,NA,NA,NA
BACHY_2013_ACC,YMA3AM8S,journalArticle,2013,"Bachy, Charles; Dolan, John R; López-García, Purificación; Deschamps, Philippe; Moreira, David",Accuracy of protist diversity assessments: morphology compared with cloning and direct pyrosequencing of 18S rRNA genes and ITS regions using the conspicuous tintinnid ciliates as a case study,The ISME Journal,NA,"1751-7362, 1751-7370",10.1038/ismej.2012.106,http://www.nature.com/articles/ismej2012106,NA,2013-02,2021-04-18T10:17:22Z,2021-04-18T10:17:22Z,2021-04-18T10:17:22Z,244-255,NA,2,7,NA,ISME J,Accuracy of protist diversity assessments,NA,NA,NA,NA,NA,NA,en,NA,NA,NA,NA,DOI.org (Crossref),NA,NA,NA,NA,NA,NA,NA,NA,NA,NA,NA,NA,NA,NA,NA,NA,NA,NA,NA,NA,NA,NA,NA,NA,NA,NA,NA,NA,NA,NA,NA,NA,NA,NA,NA,NA,NA,NA,NA,NA,NA,NA,NA,NA,NA,NA,NA,NA,NA,NA,NA,NA,NA
YANG_2017_ZOO,P4ZJIYWN,journalArticle,2017,"Yang, Jianghua; Zhang, Xiaowei; Xie, Yuwei; Song, Chao; Zhang, Yong; Yu, Hongxia; Burton, G. Allen",Zooplankton Community Profiling in a Eutrophic Freshwater Ecosystem-Lake Tai Basin by DNA Metabarcoding,Scientific Reports,NA,2045-2322,10.1038/s41598-017-01808-y,http://www.nature.com/articles/s41598-017-01808-y,NA,2017-12,2021-04-18T10:17:22Z,2021-04-18T10:17:22Z,2021-04-18T10:17:22Z,1773,NA,1,7,NA,Sci Rep,NA,NA,NA,NA,NA,NA,NA,en,NA,NA,NA,NA,DOI.org (Crossref),NA,NA,NA,NA,NA,NA,NA,NA,NA,NA,NA,NA,NA,NA,NA,NA,NA,NA,NA,NA,NA,NA,NA,NA,NA,NA,NA,NA,NA,NA,NA,NA,NA,NA,NA,NA,NA,NA,NA,NA,NA,NA,NA,NA,NA,NA,NA,NA,NA,NA,NA,NA,NA
KANG_2021_DIA,KF3QJSXW,journalArticle,2021,"Kang, Wengang; Anslan, Sten; Börner, Nicole; Schwarz, Anja; Schmidt, Robin; Künzel, Sven; Rioual, Patrick; Echeverría-Galindo, Paula; Vences, Miguel; Wang, Junbo; Schwalb, Antje","Diatom metabarcoding and microscopic analyses from sediment samples at Lake Nam Co, Tibet: The effect of sample-size and bioinformatics on the identified communities",Ecological Indicators,NA,1470160X,10.1016/j.ecolind.2020.107070,https://linkinghub.elsevier.com/retrieve/pii/S1470160X20310098,NA,2021-02,2021-04-18T10:17:22Z,2021-04-18T10:17:22Z,2021-04-18T10:17:22Z,107070,NA,NA,121,NA,Ecological Indicators,"Diatom metabarcoding and microscopic analyses from sediment samples at Lake Nam Co, Tibet",NA,NA,NA,NA,NA,NA,en,NA,NA,NA,NA,DOI.org (Crossref),NA,NA,NA,NA,NA,NA,NA,NA,NA,NA,NA,NA,NA,NA,NA,NA,NA,NA,NA,NA,NA,NA,NA,NA,NA,NA,NA,NA,NA,NA,NA,NA,NA,NA,NA,NA,NA,NA,NA,NA,NA,NA,NA,NA,NA,NA,NA,NA,NA,NA,NA,NA,NA
LEJZEROWICZ_2015_HIG,TMEAQNW5,journalArticle,2015,"Lejzerowicz, Franck; Esling, Philippe; Pillet, Loïc; Wilding, Thomas A.; Black, Kenneth D.; Pawlowski, Jan",High-throughput sequencing and morphology perform equally well for benthic monitoring of marine ecosystems,Scientific Reports,NA,2045-2322,10.1038/srep13932,http://www.nature.com/articles/srep13932,NA,2015-11,2021-04-18T10:17:22Z,2021-04-18T10:17:22Z,2021-04-18T10:17:22Z,13932,NA,1,5,NA,Sci Rep,NA,NA,NA,NA,NA,NA,NA,en,NA,NA,NA,NA,DOI.org (Crossref),NA,NA,NA,NA,NA,NA,NA,NA,NA,NA,NA,NA,NA,NA,NA,NA,NA,NA,NA,NA,NA,NA,NA,NA,NA,NA,NA,NA,NA,NA,NA,NA,NA,NA,NA,NA,NA,NA,NA,NA,NA,NA,NA,NA,NA,NA,NA,NA,NA,NA,NA,NA,NA
DZHEMBEKOVA_2020_COM,JDNG44PS,journalArticle,2020,"Dzhembekova, Nina; Rubino, Fernando; Nagai, Satoshi; Zlateva, Ivelina; Slabakova, Nataliya; Ivanova, Petya; Slabakova, Violeta; Moncheva, Snejana",Comparative analysis of morphological and molecular approaches integrated into the study of the dinoflagellate biodiversity within the recently deposited Black Sea sediments – benefits and drawbacks,Biodiversity Data Journal,NA,"1314-2828, 1314-2836",10.3897/BDJ.8.e55172,https://bdj.pensoft.net/article/55172/,"One of the assets, assigned to the phytoplankton resting stages, is that of serving as the “memory” of the aquatic ecosystems and preserved biodiversity in the course of time. However, an accurate cyst identification proves to be a more difficult and extremely challenging process, even today. In order to gain a better taxonomic coverage of cyst assemblages in the Black Sea, an integrated approach of the classical morphological identification with metabarcoding methods (MySeq sequencing of V7-V9 regions of the 18S rDNA) was applied on thirteen surface sediment samples collected from different sites. A total number of 112 dinoflagellate taxa was detected at the species level and ascribed to 51 genera. In general, it is the molecular analysis that yields a higher number of taxa as compared to those obtained through the morphological taxonomy (66 taxa based on the DNA sequences versus 56 morphologically-identified taxa). Besides, it should be pointed out that the integrated dataset includes 14 potentially toxic dinoflagellate species. Discerned, subsequently, was a good dataset consistency for ten species, followed by some discrepancies as to a number of taxa, identified with one of the methods only, due to specific methodological biases. On the whole, it could be concluded that the combination of morphological and molecular methods is likely to increase the potential for a more reliable taxonomic assessment of phytoplankton diversity in marine sediments which, in turn, proves conclusively the utmost importance of the integrated approach.",2020-08-18,2021-04-18T10:17:24Z,2021-04-18T10:17:24Z,2021-04-18T10:17:24Z,e55172,NA,NA,8,NA,BDJ,NA,NA,NA,NA,NA,NA,NA,NA,NA,NA,NA,NA,DOI.org (Crossref),NA,NA,NA,NA,NA,NA,NA,NA,NA,NA,NA,NA,NA,NA,NA,NA,NA,NA,NA,NA,NA,NA,NA,NA,NA,NA,NA,NA,NA,NA,NA,NA,NA,NA,NA,NA,NA,NA,NA,NA,NA,NA,NA,NA,NA,NA,NA,NA,NA,NA,NA,NA,NA
ZIMMERMANN_2015_MET,JIWZM8TJ,journalArticle,2015,"Zimmermann, Jonas; Glöckner, Gernot; Jahn, Regine; Enke, Neela; Gemeinholzer, Birgit",Metabarcoding vs. morphological identification to assess diatom diversity in environmental studies,Molecular Ecology Resources,NA,1755098X,10.1111/1755-0998.12336,http://doi.wiley.com/10.1111/1755-0998.12336,NA,2015-05,2021-04-18T10:17:24Z,2021-04-18T10:17:24Z,2021-04-18T10:17:24Z,526-542,NA,3,15,NA,Mol Ecol Resour,NA,NA,NA,NA,NA,NA,NA,en,NA,NA,NA,NA,DOI.org (Crossref),NA,NA,NA,NA,NA,NA,NA,NA,NA,NA,NA,NA,NA,NA,NA,NA,NA,NA,NA,NA,NA,NA,NA,NA,NA,NA,NA,NA,NA,NA,NA,NA,NA,NA,NA,NA,NA,NA,NA,NA,NA,NA,NA,NA,NA,NA,NA,NA,NA,NA,NA,NA,NA
LEESE_2021_IMP,8FX98YBZ,journalArticle,2021,"Leese, Florian; Sander, Mandy; Buchner, Dominik; Elbrecht, Vasco; Haase, Peter; Zizka, Vera M. A.",Improved freshwater macroinvertebrate detection from environmental DNA through minimized nontarget amplification,Environmental DNA,NA,"2637-4943, 2637-4943",10.1002/edn3.177,https://onlinelibrary.wiley.com/doi/10.1002/edn3.177,NA,2021-01,2021-04-18T10:17:24Z,2021-04-18T10:17:24Z,2021-04-18T10:17:24Z,261-276,NA,1,3,NA,Environmental DNA,NA,NA,NA,NA,NA,NA,NA,en,NA,NA,NA,NA,DOI.org (Crossref),NA,NA,NA,NA,NA,NA,NA,NA,NA,NA,NA,NA,NA,NA,NA,NA,NA,NA,NA,NA,NA,NA,NA,NA,NA,NA,NA,NA,NA,NA,NA,NA,NA,NA,NA,NA,NA,NA,NA,NA,NA,NA,NA,NA,NA,NA,NA,NA,NA,NA,NA,NA,NA
VIVIEN_2019_TES,7WLJSZMQ,journalArticle,2019,"Vivien, Régis; Apothéloz-Perret-Gentil, Laure; Pawlowski, Jan; Werner, Inge; Ferrari, Benoit J.D.",Testing different (e)DNA metabarcoding approaches to assess aquatic oligochaete diversity and the biological quality of sediments,Ecological Indicators,NA,1470160X,10.1016/j.ecolind.2019.105453,https://linkinghub.elsevier.com/retrieve/pii/S1470160X19304388,NA,2019-11,2021-04-18T10:17:24Z,2021-04-18T10:17:24Z,2021-04-18T10:17:24Z,105453,NA,NA,106,NA,Ecological Indicators,NA,NA,NA,NA,NA,NA,NA,en,NA,NA,NA,NA,DOI.org (Crossref),NA,NA,NA,NA,NA,NA,NA,NA,NA,NA,NA,NA,NA,NA,NA,NA,NA,NA,NA,NA,NA,NA,NA,NA,NA,NA,NA,NA,NA,NA,NA,NA,NA,NA,NA,NA,NA,NA,NA,NA,NA,NA,NA,NA,NA,NA,NA,NA,NA,NA,NA,NA,NA
SCHROEDER_2020_DNA,U2S3NW2M,journalArticle,2020,"Schroeder, Anna; Stanković, David; Pallavicini, Alberto; Gionechetti, Fabrizia; Pansera, Marco; Camatti, Elisa",DNA metabarcoding and morphological analysis - Assessment of zooplankton biodiversity in transitional waters,Marine Environmental Research,NA,1411136,10.1016/j.marenvres.2020.104946,https://linkinghub.elsevier.com/retrieve/pii/S0141113619308852,NA,2020-09,2021-04-18T10:17:25Z,2021-04-18T10:17:25Z,2021-04-18T10:17:25Z,104946,NA,NA,160,NA,Marine Environmental Research,NA,NA,NA,NA,NA,NA,NA,en,NA,NA,NA,NA,DOI.org (Crossref),NA,NA,NA,NA,NA,NA,NA,NA,NA,NA,NA,NA,NA,NA,NA,NA,NA,NA,NA,NA,NA,NA,NA,NA,NA,NA,NA,NA,NA,NA,NA,NA,NA,NA,NA,NA,NA,NA,NA,NA,NA,NA,NA,NA,NA,NA,NA,NA,NA,NA,NA,NA,NA
LI_2019_MET,IPYJ5G9N,journalArticle,2019,"Li, XiaoChuang; Huo, Shouliang; Zhang, Jingtian; Ma, Chunzi; Xiao, Zhe; Zhang, Hanxiao; Xi, Beidou; Xia, Xinghui",Metabarcoding reveals a more complex cyanobacterial community than morphological identification,Ecological Indicators,NA,1470160X,10.1016/j.ecolind.2019.105653,https://linkinghub.elsevier.com/retrieve/pii/S1470160X19306466,NA,2019-12,2021-04-18T10:17:25Z,2021-04-18T10:17:25Z,2021-04-18T10:17:25Z,105653,NA,NA,107,NA,Ecological Indicators,NA,NA,NA,NA,NA,NA,NA,en,NA,NA,NA,NA,DOI.org (Crossref),NA,NA,NA,NA,NA,NA,NA,NA,NA,NA,NA,NA,NA,NA,NA,NA,NA,NA,NA,NA,NA,NA,NA,NA,NA,NA,NA,NA,NA,NA,NA,NA,NA,NA,NA,NA,NA,NA,NA,NA,NA,NA,NA,NA,NA,NA,NA,NA,NA,NA,NA,NA,NA
VALENTINI_2016_NEX,PEBW2UTV,journalArticle,2016,"Valentini, Alice; Taberlet, Pierre; Miaud, Claude; Civade, Raphaël; Herder, Jelger; Thomsen, Philip Francis; Bellemain, Eva; Besnard, Aurélien; Coissac, Eric; Boyer, Frédéric; Gaboriaud, Coline; Jean, Pauline; Poulet, Nicolas; Roset, Nicolas; Copp, Gordon H.; Geniez, Philippe; Pont, Didier; Argillier, Christine; Baudoin, Jean-Marc; Peroux, Tiphaine; Crivelli, Alain J.; Olivier, Anthony; Acqueberge, Manon; Le Brun, Matthieu; Møller, Peter R.; Willerslev, Eske; Dejean, Tony",Next-generation monitoring of aquatic biodiversity using environmental DNA metabarcoding,Molecular Ecology,NA,9621083,10.1111/mec.13428,http://doi.wiley.com/10.1111/mec.13428,NA,2016-02,2021-04-18T10:17:26Z,2021-04-18T10:17:26Z,2021-04-18T10:17:25Z,929-942,NA,4,25,NA,Mol Ecol,NA,NA,NA,NA,NA,NA,NA,en,NA,NA,NA,NA,DOI.org (Crossref),NA,NA,NA,NA,NA,NA,NA,NA,NA,NA,NA,NA,NA,NA,NA,NA,NA,NA,NA,NA,NA,NA,NA,NA,NA,NA,NA,NA,NA,NA,NA,NA,NA,NA,NA,NA,NA,NA,NA,NA,NA,NA,NA,NA,NA,NA,NA,NA,NA,NA,NA,NA,NA
HUANG_2020_GEN,VJPR8EL9,journalArticle,2020,"Huang, S.; Herzschuh, U.; Pestryakova, L. A.; Zimmermann, H. H.; Davydova, P.; Biskaborn, B. K.; Shevtsova, I.; Stoof-Leichsenring, K. R.",Genetic and morphologic determination of diatom community composition in surface sediments from glacial and thermokarst lakes in the Siberian Arctic,Journal of Paleolimnology,NA,"0921-2728, 1573-0417",10.1007/s10933-020-00133-1,http://link.springer.com/10.1007/s10933-020-00133-1,NA,2020-10,2021-04-18T10:17:26Z,2021-04-18T10:17:26Z,2021-04-18T10:17:25Z,225-242,NA,3,64,NA,J Paleolimnol,NA,NA,NA,NA,NA,NA,NA,en,NA,NA,NA,NA,DOI.org (Crossref),NA,NA,NA,NA,NA,NA,NA,NA,NA,NA,NA,NA,NA,NA,NA,NA,NA,NA,NA,NA,NA,NA,NA,NA,NA,NA,NA,NA,NA,NA,NA,NA,NA,NA,NA,NA,NA,NA,NA,NA,NA,NA,NA,NA,NA,NA,NA,NA,NA,NA,NA,NA,NA
LEDUC_2019_COM,UIYP3DFT,journalArticle,2019,"Leduc, Noémie; Lacoursière‐Roussel, Anaïs; Howland, Kimberly L.; Archambault, Philippe; Sevellec, Maelle; Normandeau, Eric; Dispas, Antoine; Winkler, Gesche; McKindsey, Christopher W.; Simard, Nathalie; Bernatchez, Louis",Comparing eDNA metabarcoding and species collection for documenting Arctic metazoan biodiversity,Environmental DNA,NA,"2637-4943, 2637-4943",10.1002/edn3.35,https://onlinelibrary.wiley.com/doi/abs/10.1002/edn3.35,NA,2019-11,2021-04-18T10:17:26Z,2021-04-18T10:17:26Z,2021-04-18T10:17:26Z,342-358,NA,4,1,NA,Environmental DNA,NA,NA,NA,NA,NA,NA,NA,en,NA,NA,NA,NA,DOI.org (Crossref),NA,NA,NA,NA,NA,NA,NA,NA,NA,NA,NA,NA,NA,NA,NA,NA,NA,NA,NA,NA,NA,NA,NA,NA,NA,NA,NA,NA,NA,NA,NA,NA,NA,NA,NA,NA,NA,NA,NA,NA,NA,NA,NA,NA,NA,NA,NA,NA,NA,NA,NA,NA,NA
